{
  "schema": 1,
  "updatedAt": "2026-10-15",
  "_comment": "社区注册表：本市场认可的 WorkBuddy 插件 GitHub 仓库清单。静态字段（repo / displayName / category / description / keywords / trust / sourceCommit / license / review / permissions）人工审核后提交；动态字段（stars / pushedAt / latestSha / refreshedAt）由 .github/workflows/registry.yml 每天自动重建；产物与声明字段（packageUrl / packageHash / manifestHash / attestationUrl / platforms / minWorkBuddyVersion / version）由 .github/workflows/artifacts.yml（v2.17/v2.20）按打包 manifest 回写 —— 后两类请勿手工编辑。收录标准：仓库内含 SKILL.md 技能（可直接被 ghpm 安装到 ~/.workbuddy/skills）、非归档、活跃维护。市场端按 TTL 在线拉取本文件（raw → api.github.com → 本地副本三级兜底）。收录内容契约见 registry/registry-schema.json（contract v2），由 scripts/validate_registry.py 在 CI 强制校验——加字段先升契约版本。",
  "plugins": [
    {
      "repo": "anthropics/skills",
      "displayName": "Anthropic 官方技能集",
      "displayNameEn": "Anthropic Official Skills",
      "category": "官方",
      "description": "Anthropic 官方 Agent Skills 仓库，含文档处理（docx/pdf/pptx/xlsx）、前端设计、MCP 构建、画布设计、品牌规范等 19 个高质量技能。",
      "descriptionEn": "Anthropic's official repository of Agent Skills: document processing (docx/pdf/pptx/xlsx), frontend design, MCP building, canvas design, brand guidelines and more.",
      "keywords": [
        "官方",
        "文档",
        "office",
        "前端",
        "mcp"
      ],
      "homepage": "https://github.com/anthropics/skills",
      "addedAt": "2026-10-06",
      "stars": 181204,
      "pushedAt": "2026-10-09",
      "latestSha": "dbd4588f9e1033efb41dad4bef2f7947c8993d44",
      "refreshedAt": "2026-10-15",
      "trust": "official",
      "sourceCommit": "683bc88e56f3e09ba94f7055977f3d3aa499f202",
      "review": {
        "status": "reviewed",
        "reviewedAt": "2026-10-06",
        "method": "manual"
      },
      "license": "Apache-2.0",
      "packageUrl": "https://github.com/zjs105910/workbuddy-market/releases/download/registry-artifacts-2026-10-19/anthropics-skills-2026.10.19.683bc88.zip",
      "packageHash": "f6d25bc38b91b9b7b0eb89cea3d5bd5647f6deb6c7b74be05ae14ff4b39eaf5e",
      "manifestHash": "58a9b76682992f335c977375f41bdfb4cacffa9bdfac6632d69e962c4864de25",
      "attestationUrl": "https://github.com/zjs105910/workbuddy-market/releases/download/registry-artifacts-2026-10-19/anthropics-skills-2026.10.19.683bc88.zip.attestation.json"
    },
    {
      "repo": "obra/superpowers",
      "displayName": "Superpowers 工程方法论",
      "displayNameEn": "Superpowers Software Methodology",
      "category": "开发工具",
      "description": "一套成体系的软件开发方法论技能包：头脑风暴、写计划、TDD、系统化调试、并行派发子代理、代码审查、收尾分支等 15 个技能，彼此衔接成工作流。",
      "descriptionEn": "A cohesive software development methodology skill pack: brainstorming, planning, TDD, systematic debugging, parallel subagents, code review and finishing branches.",
      "keywords": [
        "方法论",
        "TDD",
        "调试",
        "计划",
        "代码审查",
        "子代理"
      ],
      "homepage": "https://github.com/obra/superpowers",
      "addedAt": "2026-10-06",
      "stars": 299229,
      "pushedAt": "2026-10-10",
      "latestSha": "bb92a77741419a4ab5f06e711a283343f1ada0c3",
      "refreshedAt": "2026-10-15",
      "trust": "reviewed",
      "sourceCommit": "8ca22dba9a94f28898bbce59f2537ff4d87c747d",
      "license": "MIT",
      "review": {
        "status": "reviewed",
        "reviewedAt": "2026-10-06",
        "method": "manual"
      },
      "packageUrl": "https://github.com/zjs105910/workbuddy-market/releases/download/registry-artifacts-2026-10-19/obra-superpowers-2026.10.19.8ca22db.zip",
      "packageHash": "49022cf9fb61ae9e1bd512339dda1f2b7ca1590a43326ff68838b30f5e234146",
      "manifestHash": "88581853be7fb512036af0eda8e53007bb11fb888d4f94e2337e818ab8c94040",
      "attestationUrl": "https://github.com/zjs105910/workbuddy-market/releases/download/registry-artifacts-2026-10-19/obra-superpowers-2026.10.19.8ca22db.zip.attestation.json"
    },
    {
      "repo": "mattpocock/skills",
      "displayName": "Matt Pocock 工程技能集",
      "displayNameEn": "Skills for Real Engineers",
      "category": "开发工具",
      "description": "知名 TypeScript 教育家 Matt Pocock 从自己的 .agents 目录里拿出来的工程技能集：面向真实工程场景的编码、评审与协作技能。",
      "descriptionEn": "Engineering skills straight from Matt Pocock's .agents directory: pragmatic coding, review and collaboration skills for real-world projects.",
      "keywords": [
        "工程",
        "编码",
        "评审",
        "TypeScript",
        "最佳实践"
      ],
      "homepage": "https://github.com/mattpocock/skills",
      "addedAt": "2026-10-07",
      "stars": 291502,
      "pushedAt": "2026-10-13",
      "latestSha": "49dd158d1076134a641b33efb035946536778336",
      "refreshedAt": "2026-10-15",
      "trust": "reviewed",
      "sourceCommit": "f3fc5632f401156837ee3872f14fe33ccf1024ea",
      "license": "MIT",
      "review": {
        "status": "reviewed",
        "reviewedAt": "2026-10-07",
        "method": "manual"
      }
    },
    {
      "repo": "garrytan/gstack",
      "displayName": "GStack 创业指挥栈",
      "displayNameEn": "Garry Tan's GStack",
      "category": "开发工具",
      "description": "Y Combinator 总裁 Garry Tan 公开的 Claude Code 配置：CEO、设计师、工程管理等 23 个观点鲜明的工具，把 AI 当成完整创业团队来指挥。",
      "descriptionEn": "Garry Tan's exact Claude Code setup: 23 opinionated tools acting as CEO, designer, engineering manager and more - run AI like a full startup team.",
      "keywords": [
        "创业",
        "管理",
        "产品",
        "工作流",
        "gstack"
      ],
      "homepage": "https://github.com/garrytan/gstack",
      "addedAt": "2026-10-07",
      "stars": 136432,
      "pushedAt": "2026-10-15",
      "latestSha": "47d639abffa882b8cbb641d7d1dedf08ecada9ec",
      "refreshedAt": "2026-10-15",
      "trust": "reviewed",
      "sourceCommit": "f67c478f05d8e0b39339599ad11c91a3478515ae",
      "license": "MIT",
      "review": {
        "status": "reviewed",
        "reviewedAt": "2026-10-07",
        "method": "manual"
      }
    },
    {
      "repo": "addyosmani/agent-skills",
      "displayName": "Addy Osmani 工程技能",
      "displayNameEn": "Production-grade Agent Skills",
      "category": "开发工具",
      "description": "Chrome 工程负责人 Addy Osmani 出品的 AI 编码智能体生产级技能集，覆盖调试、性能、架构与代码质量等方向。",
      "descriptionEn": "Production-grade engineering skills for AI coding agents by Addy Osmani (Chrome eng): debugging, performance, architecture and code quality.",
      "keywords": [
        "工程",
        "调试",
        "性能",
        "架构",
        "代码质量"
      ],
      "homepage": "https://github.com/addyosmani/agent-skills",
      "addedAt": "2026-10-07",
      "stars": 106734,
      "pushedAt": "2026-10-13",
      "latestSha": "aeac41d4d005999432bb7312f7ff06383a91d59d",
      "refreshedAt": "2026-10-15",
      "trust": "reviewed",
      "sourceCommit": "1401c8b8030e023baeebb31781a6653fe8e93026",
      "license": "MIT",
      "review": {
        "status": "reviewed",
        "reviewedAt": "2026-10-07",
        "method": "manual"
      }
    },
    {
      "repo": "nexu-io/open-design",
      "displayName": "Open Design 设计插件",
      "displayNameEn": "Open Design Plugin",
      "category": "设计",
      "description": "开源的 DSH 设计插件替代品（对标 Claude Design）：本地优先的设计能力，让智能体直接产出可用的界面与视觉稿。",
      "descriptionEn": "The open-source DeepSeek Harness design plugin (a Claude Design alternative): local-first design skills for producing usable UI and visuals.",
      "keywords": [
        "设计",
        "UI",
        "界面",
        "设计稿",
        "local-first"
      ],
      "homepage": "https://github.com/nexu-io/open-design",
      "addedAt": "2026-10-07",
      "stars": 101192,
      "pushedAt": "2026-10-15",
      "latestSha": "14fee234e6eb268058fed17ba979d8e22798dd34",
      "refreshedAt": "2026-10-15",
      "trust": "reviewed",
      "sourceCommit": "53231d40b778d88eba23f35547bf99485d3ae9fc",
      "license": "Apache-2.0",
      "review": {
        "status": "reviewed",
        "reviewedAt": "2026-10-07",
        "method": "manual"
      },
      "packageUrl": "https://github.com/zjs105910/workbuddy-market/releases/download/registry-artifacts-2026-10-19/nexu-io-open-design-2026.10.19.53231d4.zip",
      "packageHash": "4939cbeecf2f0e8ad80ac9e31fac608af47c3329a9c7682acabb0feecb93e4af",
      "manifestHash": "0a50b3ea48593182cb9e3c9cda87570fafe2b1ac401ab21d99195acd32ecce15",
      "attestationUrl": "https://github.com/zjs105910/workbuddy-market/releases/download/registry-artifacts-2026-10-19/nexu-io-open-design-2026.10.19.53231d4.zip.attestation.json"
    },
    {
      "repo": "Leonxlnx/taste-skill",
      "displayName": "Taste 品味技能",
      "displayNameEn": "Taste Skill",
      "category": "设计",
      "description": "给 AI 一双「好品味」的眼睛：阻止它生成平庸、模板化、千篇一律的输出，让界面与文案更有设计感（含安装脚本与示例）。",
      "descriptionEn": "Gives your AI good taste: stops boring, generic, template-generated output and makes UI and copy feel designed (installer and examples included).",
      "keywords": [
        "设计",
        "品味",
        "UI",
        "文案",
        "去模板化"
      ],
      "homepage": "https://github.com/Leonxlnx/taste-skill",
      "addedAt": "2026-10-07",
      "stars": 96563,
      "pushedAt": "2026-10-14",
      "latestSha": "f624f37a8c650b9cc550253104925efe4c8de246",
      "refreshedAt": "2026-10-15",
      "trust": "reviewed",
      "sourceCommit": "b482f7a970abb98c4108d4a9f761e458c64cefc8",
      "license": "MIT",
      "review": {
        "status": "reviewed",
        "reviewedAt": "2026-10-07",
        "method": "manual"
      },
      "packageUrl": "https://github.com/zjs105910/workbuddy-market/releases/download/registry-artifacts-2026-10-19/Leonxlnx-taste-skill-2026.10.19.b482f7a.zip",
      "packageHash": "a3fbb3d7139bdaf39fac29e33458a7d1a245d1a71011c6d3de58a8a3a0df3a1d",
      "manifestHash": "b9eb89513026d056ced28361ad2efca47f8f413e125867b58ff68eede442459a",
      "attestationUrl": "https://github.com/zjs105910/workbuddy-market/releases/download/registry-artifacts-2026-10-19/Leonxlnx-taste-skill-2026.10.19.b482f7a.zip.attestation.json"
    },
    {